{
  "schema_version": 1,
  "last_updated": "2026-05-11",
  "competition": {
    "name": "Stella Zhang New Venture Competition",
    "former_names": ["Merage Business Plan Competition", "UCI New Venture Competition"],
    "host_school": "UCI Paul Merage School of Business",
    "host_center": "Beall Center for Innovation & Entrepreneurship",
    "first_held": 2009,
    "naming_gift": {
      "primary_donor": "Stella Zhang",
      "donor_affiliation": "FEMBA '05",
      "co_donor": "John Shen (spouse)",
      "initial_gift_year": 2022,
      "initial_gift_term_years": 5,
      "initial_gift_amount_usd": null,
      "extension_gift_year": 2025,
      "extension_gift_amount_usd": 750000,
      "extension_gift_term_years": 5,
      "extension_raised_pool_from_usd": 100000,
      "extension_raised_pool_to_usd": 150000,
      "naming_through_year": 2031,
      "bridge_to_competition": "Zarina Bahadur (Baby Box, MIE '20, 2020 Grand Prize) joined Zhang's Long Beach Accelerator portfolio, exposing Zhang to the NVC.",
      "sources": [
        "https://merage.uci.edu/news/2022/01/New-Venture-Competition-Receives-Naming-Gift-from-Stella-Zhang-FEMBA-05.html",
        "https://merage.uci.edu/press-releases/2025/03/Stella-Zhang-Gives-750K-to-UC-Irvine-New-Venture-Competition.html"
      ]
    },
    "sponsors": [
      "The Beall Family",
      "Experian",
      "John Chuang",
      "Emanuel Shaoulian MD",
      "David Ochi",
      "Stella Zhang",
      "Elvin Kay",
      "Ken & Carla Neeld",
      "Withum",
      "Finance Agents",
      "Ingram Micro",
      "Larry Wilk"
    ],
    "sponsors_note": "Sponsors fund the program collectively. Per-track corporate sponsorship does not exist in this competition's structure; tracks are funded from the pool and named only by category.",
    "track_partnerships": [
      {
        "track": "Social Enterprise",
        "partner_organization": "UCI Blum Center",
        "named_faculty_judge": "Richard Matthew (Blum Center Faculty Director)"
      }
    ],
    "program_staff": [
      {"name": "Jenn Huynh", "role": "Program Manager"},
      {"name": "Sara Heimann", "role": "Innovation & Entrepreneurship Librarian", "contact": "sheimann@uci.edu"}
    ],
    "mentor_structure": {
      "named_program": null,
      "sources_of_mentors": ["Beall Center industry mentors", "SCORE mentors"],
      "note": "Coach and judge roles overlap; named individuals like Dan Jenkins, David Ochi, and Larry Wilk function as both."
    },
    "format": {
      "workshop_series_length_months": 7,
      "sample_workshops": [
        "How to Come up with a Billion Dollar Idea",
        "From Idea to Business",
        "Is there a Market for Your Product?"
      ]
    }
  },
  "years": [
    {
      "year": 2026,
      "status": "upcoming",
      "edition": "22nd annual",
      "grand_finale": {
        "date": "2026-05-21",
        "time": "5:00-9:00 PM PT",
        "venue": "SB1 Merage Auditorium, 4291 Pereira Drive, Suite 2300, Irvine, CA 92627"
      },
      "tracks": ["Business Products & Services", "Consumer Products", "Consumer Services", "Life Sciences", "Social Enterprise"],
      "prize_pool_announced": "Over $100,000 plus AWS credits for all semi-finalists",
      "structure": {
        "grand_prize_usd": 20000,
        "runner_up_usd": 5000,
        "track_first_usd": 10000,
        "track_second_usd": 5000
      },
      "named_semifinalists": ["AegleBio", "Billify", "NeuroBoost", "Grad2Go"],
      "semifinalist_count": 55,
      "awards": []
    },
    {
      "year": 2025,
      "status": "completed",
      "theme": "Sustainability, Student Life Solutions, and Medical Tech",
      "edition_number": "21st annual",
      "prize_pool_announced": "Over $150,000 (Cash & In-Kind)",
      "prize_pool_note": "Pool jumped from $100,000+ to $150,000+ following Stella Zhang's $750,000 March 2025 naming-gift extension; see competition.naming_gift.",
      "confirmed_judges_partial": ["Richard Matthew (Blum Center Faculty Director, Social Enterprise track judge)"],
      "judges_note": "Full grand-finale judging panel not preserved in indexed press materials; likely published in the password-protected 2025 NVC report PDF.",
      "awards": [
        {
          "category": "Grand Prize",
          "place": "Winner",
          "team": "Grad2Go",
          "prize_text": "$20,000",
          "prize_amount_usd": 20000,
          "project": "A sustainable furniture resale and storage service for students during move-out/move-in cycles to reduce waste.",
          "members": ["Yifan \"May\" Mei", "Chengxi Li", "Xinyu Zhang", "Yuhan Yue", "Yilin Shen", "Hannah"]
        },
        {
          "category": "Runner-Up",
          "place": "Winner",
          "team": "GlowGuard",
          "prize_text": "$5,000",
          "prize_amount_usd": 5000,
          "project": "Smart dental retainer case with UV-C sanitization and Bluetooth tracking capabilities.",
          "members": []
        },
        {
          "category": "Specialty (MIE Award)",
          "place": "Winner",
          "team": "PCOSitive Buddy",
          "prize_text": "$2,500",
          "prize_amount_usd": 2500,
          "project": "AI-based app supporting women with Polycystic Ovary Syndrome (PCOS) through tracking and community.",
          "members": ["Ricianne \"Chi\" Rey (MIE)"]
        },
        {
          "category": "Specialty (Audience Favorite)",
          "place": "Winner",
          "team": "Oslo",
          "prize_text": "$1,000",
          "prize_amount_usd": 1000,
          "project": "Passive thermal/optical vital-sign monitoring system for seniors (\"Birdhouse by Oslo\").",
          "members": []
        },
        {
          "category": "Track Award (Business Products)",
          "place": "1st",
          "team": "TransMobile VR",
          "prize_text": "$10,000",
          "prize_amount_usd": 10000,
          "project": "Immersive VR safety training simulations for waste-management drivers.",
          "members": []
        },
        {
          "category": "Track Award (Business Products)",
          "place": "2nd",
          "team": "ServEasy",
          "prize_text": "$5,000",
          "prize_amount_usd": 5000,
          "project": "Reverse-bidding auction platform connecting homeowners with home service providers.",
          "members": []
        },
        {
          "category": "Track Award (Consumer Products)",
          "place": "1st",
          "team": "GlowGuard",
          "prize_text": "$10,000",
          "prize_amount_usd": 10000,
          "project": "Smart dental retainer case with UV-C sanitization and Bluetooth tracking capabilities.",
          "members": [],
          "is_cross_listing": true,
          "cross_listed_with": {"category": "Runner-Up", "place": "Winner"}
        },
        {
          "category": "Track Award (Consumer Products)",
          "place": "2nd",
          "team": "NūCo",
          "prize_text": "$5,000",
          "prize_amount_usd": 5000,
          "project": "Biodegradable leather handbags made from waste coconut water.",
          "members": []
        },
        {
          "category": "Track Award (Consumer Services)",
          "place": "1st",
          "team": "PCOSitive Buddy",
          "prize_text": "$10,000",
          "prize_amount_usd": 10000,
          "project": "AI-based app supporting women with Polycystic Ovary Syndrome (PCOS) through tracking and community.",
          "members": ["Ricianne \"Chi\" Rey (MIE)"],
          "is_cross_listing": true,
          "cross_listed_with": {"category": "Specialty (MIE Award)", "place": "Winner"}
        },
        {
          "category": "Track Award (Consumer Services)",
          "place": "2nd",
          "team": "MinuTax",
          "prize_text": "$5,000",
          "prize_amount_usd": 5000,
          "project": "AI-powered automated tax-filing platform tailored for international students.",
          "members": []
        },
        {
          "category": "Track Award (Life Sciences)",
          "place": "1st",
          "team": "NasoCoustics",
          "prize_text": "$10,000",
          "prize_amount_usd": 10000,
          "project": "Wireless, child-friendly nasometry device for speech therapy in cleft palate patients.",
          "members": ["Dave Soliven", "Jordan Ulibarri", "Kenji Inducta", "Natalie Benneian", "Neha Muvvala", "Neharika Gopikrishnan"]
        },
        {
          "category": "Track Award (Life Sciences)",
          "place": "2nd",
          "team": "Oslo",
          "prize_text": "$5,000",
          "prize_amount_usd": 5000,
          "project": "Passive thermal/optical vital-sign monitoring system for seniors (\"Birdhouse by Oslo\").",
          "members": [],
          "is_cross_listing": true,
          "cross_listed_with": {"category": "Specialty (Audience Favorite)", "place": "Winner"}
        },
        {
          "category": "Track Award (Social Enterprise)",
          "place": "1st",
          "team": "CleanHydro",
          "prize_text": "$10,000",
          "prize_amount_usd": 10000,
          "project": "AI-powered app for real-time analysis of water quality test strips and samples.",
          "members": []
        },
        {
          "category": "Track Award (Social Enterprise)",
          "place": "2nd",
          "team": "Grad2Go",
          "prize_text": "$5,000",
          "prize_amount_usd": 5000,
          "project": "A sustainable furniture resale and storage service for students during move-out/move-in cycles to reduce waste.",
          "members": ["Yifan \"May\" Mei", "Chengxi Li", "Xinyu Zhang", "Yuhan Yue", "Yilin Shen", "Hannah"],
          "is_cross_listing": true,
          "cross_listed_with": {"category": "Grand Prize", "place": "Winner"}
        }
      ]
    },
    {
      "year": 2024,
      "status": "completed",
      "theme": "Artificial Intelligence (AI) and Industrial Safety",
      "edition_number": "20th annual",
      "judges_and_coaches": [